pub_date,title,venue,excerpt,author,url_slug,paper_url,citation
2013,Activation of lysosomal function in the course of autophagy via mTORC1 suppression and autophagosome-lysosome fusion,Cell Research,,"Jing Zhou, Shi-Hao Tan, Valerie Nicolas, Chantal Bauvy, Nai-Di Yang, Jianbin Zhang, Yuan Xue, Patrice Codogno, Han-Ming Shen.",Activation of lysosomal function in the course of autophagy via mTORC1 suppression and autophagosome-lysosome fusion,https://www.nature.com/articles/cr201311,"Jing Zhou, Shi-Hao Tan, Valerie Nicolas, Chantal Bauvy, Nai-Di Yang, Jianbin Zhang, Yuan Xue, Patrice Codogno, Han-Ming Shen. Cell Research (2013). Activation of lysosomal function in the course of autophagy via mTORC1 suppression and autophagosome-lysosome fusion."
2015,The RpoE stress response pathway mediates reduction of enteropathogenic Escherichia coli virulence by zinc,Applied and Environmental Microbiology,,"Yuan Xue, Jossef Osborn, Anand Panchal, Jay L. Mellies.",The RpoE stress response pathway mediates reduction of enteropathogenic Escherichia coli virulence by zinc,https://aem.asm.org/content/81/11/3766/article-info,"Yuan Xue, Jossef Osborn, Anand Panchal, Jay L. Mellies. Applied and Environmental Microbiology (2015). The RpoE stress response pathway mediates reduction of enteropathogenic Escherichia coli virulence by zinc."
2018,Single-cell transcriptomics of 20 mouse organs creates a Tabula Muris,Nature,,"The Tabula Muris Consortium, Stephen R. Quake, Tony Wyss-Coray, Spyros Darmanis.",Single-cell transcriptomics of 20 mouse organs creates a Tabula Muris,https://www.nature.com/articles/s41586-018-0590-4;https://www.biorxiv.org/content/10.1101/237446v2,"The Tabula Muris Consortium, Stephen R. Quake, Tony Wyss-Coray, Spyros Darmanis. Nature (2018). Single-cell transcriptomics of 20 mouse organs creates a Tabula Muris."
2019,Self-assembling Manifolds in Single-cell RNA Sequencing Data,eLife,,"Alexander J Tarashansky, Yuan Xue, Pengyang Li, Stephen R Quake, Bo Wang.",Self-assembling Manifolds in Single-cell RNA Sequencing Data,https://elifesciences.org/articles/48994;https://www.biorxiv.org/content/10.1101/364166v2,"Alexander J Tarashansky, Yuan Xue, Pengyang Li, Stephen R Quake, Bo Wang. eLife (2019). Self-assembling Manifolds in Single-cell RNA Sequencing Data."
2020,A single-parasite transcriptional landscape of asexual development in Toxoplasma gondii,eLife,,"Yuan Xue, Terence T. Theisen, Suchita Rastogi, Abel Ferrel, Stephen R. Quake, John C. Boothroyd.",A single-parasite transcriptional landscape of asexual development in Toxoplasma gondii,https://elifesciences.org/articles/54129;https://www.biorxiv.org/content/10.1101/656165v1,"Yuan Xue, Terence T. Theisen, Suchita Rastogi, Abel Ferrel, Stephen R. Quake, John C. Boothroyd. eLife (2020). A single-parasite transcriptional landscape of asexual development in Toxoplasma gondii."
2020,Differential Impacts on Host Transcription by ROP and GRA Effectors from the Intracellular Parasite Toxoplasma gondii,mBio,,"Suchita Rastogi, Yuan Xue, Stephen R. Quake, John C. Boothroyd.",Differential Impacts on Host Transcription by ROP and GRA Effectors from the Intracellular Parasite Toxoplasma gondii,https://www.biorxiv.org/content/10.1101/2020.02.04.934570v2.abstract,"Suchita Rastogi, Yuan Xue, Stephen R. Quake, John C. Boothroyd. mBio (2020). Differential Impacts on Host Transcription by ROP and GRA Effectors from the Intracellular Parasite Toxoplasma gondii."
